{
  "formatVersion": "1.0.0",
  "id": "generic-technical-symbols",
  "version": "1.0.0",
  "licence": "AGPL-3.0-only",
  "symbols": [
    {
      "id": "architecture.north",
      "name": "Nord",
      "version": "1.0.0",
      "semanticType": "NORTH_ARROW",
      "discipline": "ARCHITECTURE",
      "provenance": {
        "type": "GENERIC",
        "reference": "Glyphes techniques dessinés pour cette application — ne reproduit aucune planche normalisée"
      },
      "viewBox": {
        "min": {
          "x": -3,
          "y": -3
        },
        "max": {
          "x": 3,
          "y": 3
        }
      },
      "anchors": [
        {
          "id": "origin",
          "point": {
            "x": 0,
            "y": 0
          },
          "kind": "INSERTION"
        }
      ],
      "primitives": [
        {
          "kind": "POLYGON",
          "points": [
            {
              "x": 0,
              "y": -3
            },
            {
              "x": 1.5,
              "y": 2
            },
            {
              "x": 0,
              "y": 1
            },
            {
              "x": -1.5,
              "y": 2
            }
          ],
          "role": "SYMBOL"
        }
      ],
      "scaleRules": {
        "space": "PAPER_SPACE",
        "nominalSizeMm": 6
      }
    },
    {
      "id": "architecture.room-marker",
      "name": "Repère de pièce",
      "version": "1.0.0",
      "semanticType": "ROOM_MARKER",
      "discipline": "ARCHITECTURE",
      "provenance": {
        "type": "GENERIC",
        "reference": "Glyphes techniques dessinés pour cette application — ne reproduit aucune planche normalisée"
      },
      "viewBox": {
        "min": {
          "x": -3,
          "y": -3
        },
        "max": {
          "x": 3,
          "y": 3
        }
      },
      "anchors": [
        {
          "id": "origin",
          "point": {
            "x": 0,
            "y": 0
          },
          "kind": "INSERTION"
        }
      ],
      "primitives": [
        {
          "kind": "CIRCLE",
          "center": {
            "x": 0,
            "y": 0
          },
          "radius": 2,
          "role": "SYMBOL"
        }
      ],
      "scaleRules": {
        "space": "PAPER_SPACE",
        "nominalSizeMm": 6
      }
    },
    {
      "id": "water.valve",
      "name": "Vanne",
      "version": "1.0.0",
      "semanticType": "VALVE",
      "discipline": "WATER",
      "provenance": {
        "type": "GENERIC",
        "reference": "Glyphes techniques dessinés pour cette application — ne reproduit aucune planche normalisée"
      },
      "viewBox": {
        "min": {
          "x": -3,
          "y": -3
        },
        "max": {
          "x": 3,
          "y": 3
        }
      },
      "anchors": [
        {
          "id": "origin",
          "point": {
            "x": 0,
            "y": 0
          },
          "kind": "INSERTION"
        }
      ],
      "primitives": [
        {
          "kind": "POLYGON",
          "points": [
            {
              "x": -2,
              "y": -1.5
            },
            {
              "x": 0,
              "y": 0
            },
            {
              "x": -2,
              "y": 1.5
            }
          ],
          "role": "WATER_COLD"
        },
        {
          "kind": "POLYGON",
          "points": [
            {
              "x": 2,
              "y": -1.5
            },
            {
              "x": 0,
              "y": 0
            },
            {
              "x": 2,
              "y": 1.5
            }
          ],
          "role": "WATER_COLD"
        }
      ],
      "scaleRules": {
        "space": "PAPER_SPACE",
        "nominalSizeMm": 6
      }
    },
    {
      "id": "water.flow",
      "name": "Sens de flux",
      "version": "1.0.0",
      "semanticType": "FLOW_DIRECTION",
      "discipline": "WATER",
      "provenance": {
        "type": "GENERIC",
        "reference": "Glyphes techniques dessinés pour cette application — ne reproduit aucune planche normalisée"
      },
      "viewBox": {
        "min": {
          "x": -3,
          "y": -3
        },
        "max": {
          "x": 3,
          "y": 3
        }
      },
      "anchors": [
        {
          "id": "origin",
          "point": {
            "x": 0,
            "y": 0
          },
          "kind": "INSERTION"
        }
      ],
      "primitives": [
        {
          "kind": "POLYLINE",
          "points": [
            {
              "x": -2.5,
              "y": 0
            },
            {
              "x": 2.5,
              "y": 0
            },
            {
              "x": 1,
              "y": -1.2
            },
            {
              "x": 2.5,
              "y": 0
            },
            {
              "x": 1,
              "y": 1.2
            }
          ],
          "role": "WATER_COLD"
        }
      ],
      "scaleRules": {
        "space": "PAPER_SPACE",
        "nominalSizeMm": 6
      }
    },
    {
      "id": "ventilation.supply",
      "name": "Bouche de soufflage",
      "version": "1.0.0",
      "semanticType": "SUPPLY_TERMINAL",
      "discipline": "VENTILATION",
      "provenance": {
        "type": "GENERIC",
        "reference": "Glyphes techniques dessinés pour cette application — ne reproduit aucune planche normalisée"
      },
      "viewBox": {
        "min": {
          "x": -3,
          "y": -3
        },
        "max": {
          "x": 3,
          "y": 3
        }
      },
      "anchors": [
        {
          "id": "origin",
          "point": {
            "x": 0,
            "y": 0
          },
          "kind": "INSERTION"
        }
      ],
      "primitives": [
        {
          "kind": "CIRCLE",
          "center": {
            "x": 0,
            "y": 0
          },
          "radius": 2,
          "role": "VENT_SUPPLY"
        },
        {
          "kind": "LINE",
          "start": {
            "x": -1.4,
            "y": -1.4
          },
          "end": {
            "x": 1.4,
            "y": 1.4
          },
          "role": "VENT_SUPPLY"
        },
        {
          "kind": "LINE",
          "start": {
            "x": -1.4,
            "y": 1.4
          },
          "end": {
            "x": 1.4,
            "y": -1.4
          },
          "role": "VENT_SUPPLY"
        }
      ],
      "scaleRules": {
        "space": "PAPER_SPACE",
        "nominalSizeMm": 6
      }
    },
    {
      "id": "ventilation.extract",
      "name": "Bouche d'extraction",
      "version": "1.0.0",
      "semanticType": "EXTRACT_TERMINAL",
      "discipline": "VENTILATION",
      "provenance": {
        "type": "GENERIC",
        "reference": "Glyphes techniques dessinés pour cette application — ne reproduit aucune planche normalisée"
      },
      "viewBox": {
        "min": {
          "x": -3,
          "y": -3
        },
        "max": {
          "x": 3,
          "y": 3
        }
      },
      "anchors": [
        {
          "id": "origin",
          "point": {
            "x": 0,
            "y": 0
          },
          "kind": "INSERTION"
        }
      ],
      "primitives": [
        {
          "kind": "CIRCLE",
          "center": {
            "x": 0,
            "y": 0
          },
          "radius": 2,
          "role": "VENT_EXHAUST"
        }
      ],
      "scaleRules": {
        "space": "PAPER_SPACE",
        "nominalSizeMm": 6
      }
    },
    {
      "id": "electrical.socket",
      "name": "Prise",
      "version": "1.0.0",
      "semanticType": "SOCKET_OUTLET",
      "discipline": "ELECTRICAL",
      "provenance": {
        "type": "GENERIC",
        "reference": "Glyphes techniques dessinés pour cette application — ne reproduit aucune planche normalisée"
      },
      "viewBox": {
        "min": {
          "x": -3,
          "y": -3
        },
        "max": {
          "x": 3,
          "y": 3
        }
      },
      "anchors": [
        {
          "id": "origin",
          "point": {
            "x": 0,
            "y": 0
          },
          "kind": "INSERTION"
        }
      ],
      "primitives": [
        {
          "kind": "CIRCLE",
          "center": {
            "x": 0,
            "y": 0
          },
          "radius": 2,
          "role": "ELECTRICAL_POWER"
        },
        {
          "kind": "LINE",
          "start": {
            "x": -1.4,
            "y": 0
          },
          "end": {
            "x": 1.4,
            "y": 0
          },
          "role": "ELECTRICAL_POWER"
        }
      ],
      "scaleRules": {
        "space": "PAPER_SPACE",
        "nominalSizeMm": 6
      }
    },
    {
      "id": "electrical.light-point",
      "name": "Point lumineux",
      "version": "1.0.0",
      "semanticType": "LIGHT_POINT",
      "discipline": "ELECTRICAL",
      "provenance": {
        "type": "GENERIC",
        "reference": "Glyphes techniques dessinés pour cette application — ne reproduit aucune planche normalisée"
      },
      "viewBox": {
        "min": {
          "x": -3,
          "y": -3
        },
        "max": {
          "x": 3,
          "y": 3
        }
      },
      "anchors": [
        {
          "id": "origin",
          "point": {
            "x": 0,
            "y": 0
          },
          "kind": "INSERTION"
        }
      ],
      "primitives": [
        {
          "kind": "CIRCLE",
          "center": {
            "x": 0,
            "y": 0
          },
          "radius": 2,
          "role": "ELECTRICAL_LIGHTING"
        },
        {
          "kind": "LINE",
          "start": {
            "x": -1.4,
            "y": -1.4
          },
          "end": {
            "x": 1.4,
            "y": 1.4
          },
          "role": "ELECTRICAL_LIGHTING"
        },
        {
          "kind": "LINE",
          "start": {
            "x": -1.4,
            "y": 1.4
          },
          "end": {
            "x": 1.4,
            "y": -1.4